{
  "verification": "TASK_RED",
  "summary": "First handle accepted; second has a causal verification failure.",
  "verify_command": "pytest tests/test_contract.py -q",
  "verify_output": "1 passed, 1 failed",
  "commit_sha": "abc123def456",
  "changed_files": ["src/contract.py", "src/consumer.py"],
  "blockers": ["T1.2: consumer assertion fails"],
  "task_results": [
    {
      "handle": "T1.1",
      "commit_sha": "abc123def456",
      "verify_command": "pytest tests/test_contract.py::test_contract -q",
      "verify_exit_code": 0,
      "verify_output": "1 passed",
      "state": "FOCUSED_PASS",
      "changed_files": ["src/contract.py"],
      "blockers": []
    },
    {
      "handle": "T1.2",
      "commit_sha": "abc123def456",
      "verify_command": "pytest tests/test_contract.py::test_consumer -q",
      "verify_exit_code": 1,
      "verify_output": "AssertionError: consumer field missing",
      "state": "TASK_RED",
      "changed_files": ["src/consumer.py"],
      "blockers": ["Consumer field propagation incomplete"]
    }
  ]
}
